{
  "name": "4er-Grid",
  "kurz": "4er",
  "abstand": 8,
  "bereiche": [
    { "id": "oben-links", "x": 0, "y": 0, "b": 50, "h": 50 },
    { "id": "oben-rechts", "x": 50, "y": 0, "b": 50, "h": 50 },
    { "id": "unten-links", "x": 0, "y": 50, "b": 50, "h": 50 },
    { "id": "unten-rechts", "x": 50, "y": 50, "b": 50, "h": 50 }
  ]
}
